latitude,longitude,name,year,status
13.9326861,75.5668833,Shimoga Institute of Medical Sciences,2007,Recognized
28.4594965,77.0266383,Shree Guru Gobind Singh Tricentenary Medical College,2010,Recognized
16.8457349,75.7113361,Shri B M Patil Medical College,1986,Recognized
30.302495,78.017755,Shri Guru Ram Rai Institute of Medical and Health Sciences,2006,Recognized
26.1669805,85.3933732,Shri Krishna Medical College,1970,Recognized
28.3670355,79.4304381,Shri Ram Murti Smarak Institute of Medical Sciences,2005,Recognized
12.8341735,79.7036402,Shri Satya Sai Medical College and Research Institute,2008,Recognized
20.3887937,78.1204073,Shri Vasant Rao Naik Govt. Medical College,1989,Recognized
13.3762805,77.0969868,Shridevi Institute of Medical Sciences and Research Hospital,2013,Not Recognized
24.5317925,81.2997946,Shyam Shah Medical College,1963,Recognized
27.317301,88.597116,Sikkim Manipal Institute of Medical Sciences,2000,Recognized
24.8332708,92.7789054,Silchar Medical College,1968,Recognized
19.9974533,73.7898023,SMBT Institute of Medical Sciences and Research Centre,2014,Not Recognized
26.9056683,75.8188946,SMS Medical College,1947,Recognized
18.4557516,73.8216568,Smt. Kashibai Navale Medical College and General Hospital,2007,Recognized
23.022505,72.5713621,Smt. N.H.L.Municipal Medical College,1963,Recognized
13.0826802,80.2707184,Sree Balaji Medical College and Hospital,2003,Recognized
8.5241391,76.9366376,Sree Gokulam Medical College Trust and Research Foundation,2005,Recognized
8.0883064,77.5384507,Sree Mookambika Institute of Medical Sciences,2006,Recognized
10.1566973,76.2823055,Sree Narayana Instt. of Medical Sciences,2009,Recognized
8.5241391,76.9366376,Sree Uthradom Thiurnal Academy of Medical Sciences,2006,Recognized
22.7195687,75.8577258,Sri Aurobindo Medical College and Post Graduate Institute ,2003,Recognized
20.8638142,74.761869,Sri Bhausaheb Hire Government Medical College,1988,Recognized
13.1322605,78.1745235,Sri Devaraj URS Medical College,1986,Recognized
31.6153665,74.8819618,Sri Guru Ram Das Institute of Medical Sciences and Research,1997,Recognized
11.937351,79.736833,Sri Lakshmi Narayana Institute of Medical Sciences,2006,Recognized
11.921612,79.628211,Sri Manakula Vinayagar Medical College and Hospital,2006,Recognized
13.0182099,80.1089895,Sri Muthukumaran Medical College,2010,Not Recognized
13.6287557,79.4191795,Sri Padmavathi Medical College for Women,2014,Recognized
13.0826802,80.2707184,Sri Ramachandra Medical College and Research Institute,1985,Recognized
13.3460312,77.0570339,Sri Siddhartha Medical College,1988,Recognized
11.9138598,79.8144722,Sri Venkateswaraa Medical College,2007,Recognized
13.012053,74.796608,Srinivas Institute of Medical Research Centre,2011,Not Recognized
12.8341735,79.7036402,SRM Medical College Hospital and Research Centre,2005,Recognized
18.7334416,76.3680696,SRTR Medical College,1974,Recognized
12.9283851,77.6181888,St. Johns Medical College,1963,Recognized
13.1061123,80.2868837,Stanley Medical College,1838,Recognized
13.9329334,75.6171716,Subbaiah Institute of Medical Sciences,2012,Recognized
28.9844618,77.7064137,Subharti Medical College,1996,Recognized
21.1702401,72.8310607,Surat Municipal Institute of Medical Education and Research,1999,Recognized
9.4161082,76.3477836,T D Medical College,1963,Recognized
12.8601727,80.1359943,Tagore Medical College and Hospital,2010,Recognized
28.8315925,78.7782764,Teerthanker Mahaveer Medical College,2008,Recognized
19.0395436,73.0135382,Terna Medical College,1991,Recognized
26.6528495,92.7925592,Tezpur Medical College and Hospital,2014,Recognized
10.7584048,79.1082784,Thanjavur Medical College,1959,Recognized
12.9715987,77.5945627,The Oxford Medical College,2014,Not Recognized
10.0103658,77.4768115,Theni Government Medical College,2006,Recognized
10.7713187,79.6369974,Thiruvarur Govt. Medical College,2010,Recognized
8.7880241,78.118313,Thoothukudi Medical College,2000,Recognized
8.715519,77.7555631,Tirunelveli Medical College,1965,Recognized
18.9730955,72.8215678,Topiwala National Medical College,1964,Recognized
8.8754784,76.6436398,Travancore Medical College,2009,Recognized
23.831457,91.2867777,Tripura Medical College and Dr. B R A M Teaching Hospital,2006,Recognized
26.9614505,78.9620555,U.P. Rural Institute of Medical Sciences and Research,2006,Recognized
28.6833533,77.3097765,University College of Medical Sciences and GTB Hospital,1971,Recognized
25.1240603,85.4594749,Vardhman Institute of Medical Sciences,2013,Recognized
28.583334,77.205833,Vardhman Mahavir Medical College and Safdarjung Hospital,2002,Recognized
30.22,78.78,Veer Chandra Singh Garhwali Govt. Medical Sc. and Research Instt,2008,Recognized
9.9252007,78.1197754,Velammal Medical College Hospital and Research Institute,2013,Recognized
15.1543232,76.8965961,Vijaynagar Institute of Medical Sciences,1961,Recognized
11.5825255,78.061627,Vinayaka Missions Kirupananda Variyar Medical College,1996,Recognized
11.9138598,79.8144722,Vinayaka Missions Medical College,1997,Recognized
15.8281257,78.0372792,Viswabharathi Medical College,2014,Not Recognized
21.5718403,73.1615127,Vivekanand Institute Of Medical Sciences and Research,2001,Not Recognized
21.5005155,83.8865181,VSS Medical College,1959,Recognized
12.9752267,77.7292916,Vydehi Institute Of Medical Sciences and Research Centre,2002,Recognized
12.8119405,74.8812309,Yenepoya Medical College,1999,Recognized
